### ISSUE TITLE
can't connect to gerbera server successfully

### ISSUE THREAD

**Issue by truelv** [gerbera/gerbera-mobile-app#49]
**gerbera server version**：Gerbera UPnP Server version 1.3.0

**app version**：https://storage.googleapis.com/gh-assets/gerbera-861b92c363074151a2b8b524acc811bf-signed.apk 

**debug info**：
1. gerbera server log is empty
2. tcpdump
15:56:14.596142 IP (tos 0x0, ttl 64, id 63406, offset 0, flags [DF], proto TCP (6), length 52)
    192.168.18.2.57410 > 192.168.18.3.49152: Flags [.], cksum 0xde61 (correct), ack 1, win 343, options [nop,nop,TS val 244107911 ecr 1846850], length 0
	0x0000:  fc7c 028c e593 c2d0 a805 5bcc 0800 4500  .|........[...E.
	0x0010:  0034 f7ae 4000 4006 9dbf c0a8 1202 c0a8  .4..@.@.........
	0x0020:  1203 e042 c000 1cb7 6521 71a5 567b 8010  ...B....e!q.V{..
	0x0030:  0157 de61 0000 0101 080a 0e8c ca87 001c  .W.a............
	0x0040:  2e42                                     .B
15:56:14.597088 IP (tos 0x0, ttl 64, id 63407, offset 0, flags [DF], proto TCP (6), length 52)
    192.168.18.2.57410 > 192.168.18.3.49152: Flags [F.], cksum 0xde60 (correct), seq 1, ack 1, win 343, options [nop,nop,TS val 244107911 ecr 1846850], length 0
	0x0000:  fc7c 028c e593 c2d0 a805 5bcc 0800 4500  .|........[...E.
	0x0010:  0034 f7af 4000 4006 9dbe c0a8 1202 c0a8  .4..@.@.........
	0x0020:  1203 e042 c000 1cb7 6521 71a5 567b 8011  ...B....e!q.V{..
	0x0030:  0157 de60 0000 0101 080a 0e8c ca87 001c  .W.`............
	0x0040:  2e42                                     .B
15:56:14.597257 IP (tos 0x0, ttl 64, id 30776, offset 0, flags [DF], proto TCP (6), length 272)
    192.168.18.3.49152 > 192.168.18.2.57410: Flags [P.], cksum 0xa658 (incorrect -> 0x6aeb), seq 1:221, ack 2, win 227, options [nop,nop,TS val 1846851 ecr 244107911], length 220
	0x0000:  c2d0 a805 5bcc fc7c 028c e593 0800 4500  ....[..|......E.
	0x0010:  0110 7838 4000 4006 1c5a c0a8 1203 c0a8  ..x8@.@..Z......
	0x0020:  1202 c000 e042 71a5 567b 1cb7 6522 8018  .....Bq.V{..e"..
	0x0030:  00e3 a658 0000 0101 080a 001c 2e43 0e8c  ...X.........C..
	0x0040:  ca87 4854 5450 2f30 2e30 2034 3030 2042  ..HTTP/0.0.400.B
	0x0050:  6164 2052 6571 7565 7374 0d0a 5345 5256  ad.Request..SERV
	0x0060:  4552 3a20 4c69 6e75 782f 342e 392e 3736  ER:.Linux/4.9.76
	0x0070:  2c20 5550 6e50 2f31 2e30 2c20 506f 7274  ,.UPnP/1.0,.Port
	0x0080:  6162 6c65 2053 444b 2066 6f72 2055 506e  able.SDK.for.UPn
	0x0090:  5020 6465 7669 6365 732f 312e 382e 340d  P.devices/1.8.4.
	0x00a0:  0a0d 0a43 4f4e 5445 4e54 2d4c 454e 4754  ...CONTENT-LENGT
	0x00b0:  483a 2035 300d 0a41 6363 6570 742d 5261  H:.50..Accept-Ra
	0x00c0:  6e67 6573 3a20 6279 7465 730d 0a43 4f4e  nges:.bytes..CON
	0x00d0:  5445 4e54 2d54 5950 453a 2074 6578 742f  TENT-TYPE:.text/
	0x00e0:  6874 6d6c 0d0a 0d0a 3c68 746d 6c3e 3c62  html....<html><b
	0x00f0:  6f64 793e 3c68 313e 3430 3020 4261 6420  ody><h1>400.Bad.
	0x0100:  5265 7175 6573 743c 2f68 313e 3c2f 626f  Request</h1></bo
	0x0110:  6479 3e3c 2f68 746d 6c3e 0d0a 0d0a       dy></html>....
15:56:14.597296 IP (tos 0x0, ttl 64, id 30777, offset 0, flags [DF], proto TCP (6), length 52)
    192.168.18.3.49152 > 192.168.18.2.57410: Flags [F.], cksum 0xa57c (incorrect -> 0xddf6), seq 221, ack 2, win 227, options [nop,nop,TS val 1846851 ecr 244107911], length 0
	0x0000:  c2d0 a805 5bcc fc7c 028c e593 0800 4500  ....[..|......E.
	0x0010:  0034 7839 4000 4006 1d35 c0a8 1203 c0a8  .4x9@.@..5......
	0x0020:  1202 c000 e042 71a5 5757 1cb7 6522 8011  .....Bq.WW..e"..
	0x0030:  00e3 a57c 0000 0101 080a 001c 2e43 0e8c  ...|.........C..
	0x0040:  ca87                                     ..
15:56:14.600564 IP (tos 0x0, ttl 64, id 0, offset 0, flags [DF], proto TCP (6), length 40)
    192.168.18.2.57410 > 192.168.18.3.49152: Flags [R], cksum 0xe86d (correct), seq 481781026, win 0, length 0
	0x0000:  fc7c 028c e593 c2d0 a805 5bcc 0800 4500  .|........[...E.
	0x0010:  0028 0000 4000 4006 957a c0a8 1202 c0a8  .(..@.@..z......
	0x0020:  1203 e042 c000 1cb7 6522 0000 0000 5004  ...B....e"....P.
	0x0030:  0000 e86d 0000 0000 0000 0000            ...m........
15:56:14.601362 IP (tos 0x0, ttl 64, id 0, offset 0, flags [DF], proto TCP (6), length 40)
    192.168.18.2.57410 > 192.168.18.3.49152: Flags [R], cksum 0xe86d (correct), seq 481781026, win 0, length 0
	0x0000:  fc7c 028c e593 c2d0 a805 5bcc 0800 4500  .|........[...E.
	0x0010:  0028 0000 4000 4006 957a c0a8 1202 c0a8  .(..@.@..z......
	0x0020:  1203 e042 c000 1cb7 6522 0000 0000 5004  ...B....e"....P.
	0x0030:  0000 e86d 0000 0000 0000 0000            ...m........

**compare**：android vlc 3.5.3 is ok
